<!ELEMENT notes (note+)>
<!ELEMENT note (to, from, subject, message)>
<!ELEMENT to (#PCDATA)>
<!ELEMENT from (#PCDATA)>
<!ELEMENT subject (#PCDATA)>
<!ELEMENT message (#PCDATA)>