<?xml version="1.0" encoding="UTF-8"?>
<!DOCTYPE notes SYSTEM "5.notes.dtd"> 
<notes>
<note>
<to>Ramesh</to>
<from>Krishna</from>
<subject> This is my first xml</subject>
<message>This is my first message for xml</message>
</note>
<note>
<to>Sita</to>
<from>Gita</from>
<subject> This is my first xml</subject>
<message> This is my second message for xml</message> </note>
</notes>

